<!ELEMENT Clasificacion (Posicion+)>
<!ELEMENT Posicion (NOMBRE,PARTIDOS_JUGADOS,VICTORIAS,DERROTAS,PUNTOS)>
<!ELEMENT NOMBRE (#PCDATA)>
<!ELEMENT PARTIDOS_JUGADOS (#PCDATA)>
<!ELEMENT VICTORIAS (#PCDATA)>
<!ELEMENT DERROTAS (#PCDATA)>
<!ELEMENT PUNTOS (#PCDATA)>